{
  "schemaVersion": "fams.current_stage_state.v1",
  "effectiveAt": "2026-07-16T22:21:45+08:00",
  "stage": "controlled_automation_scope_accepted",
  "statusSourcePolicy": "automation_must_read_this_file_before_markdown_status_text",
  "substageManifestSource": "docs/S0_S8_SUBSTAGE_ACCEPTANCE_MANIFESTS.json",
  "nextStageManifestSource": "docs/FTR_0_FTR_6_SUBSTAGE_ACCEPTANCE_MANIFESTS.json",
  "tradeBoundaryContract": "docs/TRADE_BOUNDARY_CONTRACT.md",
  "formalDataGovernanceContract": "docs/FORMAL_DATA_GOVERNANCE_CONTRACT.md",
  "benchmarkEnumContract": "docs/BENCHMARK_ENUM_CONTRACT.md",
  "formalValidationMetricDefinitions": "docs/FORMAL_VALIDATION_METRIC_DEFINITIONS.md",
  "supersedes": [
    "2026-07-01-chatbox-baseline",
    "2026-07-07-ux-f7-documentation-baseline",
    "2026-07-14-next-stage-documentation-risk-closure"
  ],
  "implementationApprovalRequired": true,
  "implementationEntry": "after_human_approval_and_ftr_0_gate",
  "reviewStatus": "PASS_FOR_CONTROLLED_DEVELOPMENT_ACCEPTANCE_NOT_FORMAL_TRADING_RELEASE",
  "documentationSupportsControlledNextStageDevelopment": true,
  "documentationSupportsSubstageAcceptance": true,
  "documentationSupportsUnattendedEndToEndAutomation": false,
  "documentationSupportsFormalTradingRelease": false,
  "chatGptReview": {
    "reviewedAt": "2026-07-16",
    "result": "PASS_FOR_CONTROLLED_DEVELOPMENT",
    "summary": "当前文档可以支撑下一阶段受控自动化开发、分阶段验收和审计驱动实现；不支持无人值守自动出门或正式交易 release。"
  },
  "nextStage": {
    "stageId": "formal_release_readiness_closure",
    "documentationStatus": "ready_for_human_review",
    "implementationStatus": "not_started",
    "implementationApprovalRequired": true,
    "unattendedReleaseAllowed": false,
    "targetExitClaim": "formalTradingReleaseReviewReady",
    "targetExitDoesNotImplyTradingUnlock": true,
    "releaseApprovalStatus": "pending_human_approval"
  },
  "statuses": {
    "documentationConsistencyReady": true,
    "drawioCurrentTargetRelationReady": true,
    "controlledAutomationDevelopmentImplemented": true,
    "documentationSupportedScopeAccepted": true,
    "researchReady": true,
    "manualTradeDraftReady": true,
    "portfolioBacktestFormalReviewReady": true,
    "ordinaryUserExperienceReady": true,
    "frontendComplexityReduced": true,
    "chatBoxFirstClassReady": true,
    "chatBoxExperienceOptimized": true,
    "chatBoxPlainLanguageReady": true,
    "chatBoxDataHealthUxReady": true,
    "assetExcelImportExportReady": true,
    "expertModuleTabsPreserved": true,
    "formalDataGovernancePassed": false,
    "benchmarkQualificationPassed": false,
    "formalValidationPassed": false,
    "manualSignoffPassed": false,
    "executionIsolationPassed": true,
    "formalTradingReleaseReviewReady": false,
    "formalTradingReleaseReady": false,
    "formalTradingUnlocked": false,
    "autoTradeUnlocked": false,
    "canCreateOrder": false,
    "orderCreateAllowed": false
  },
  "allowedActions": [
    "RESEARCH",
    "OBSERVE",
    "COMPARE",
    "ALERT",
    "PLAN_DRAFT",
    "MANUAL_TRADE_DRAFT"
  ],
  "prohibitedActions": [
    "ADD",
    "REDUCE",
    "ORDER_CREATE",
    "AUTO_TRADE"
  ],
  "blockingExternalGates": [
    "formal_provider_authorization",
    "official_or_trusted_total_return_benchmark",
    "formal_validation_statistical_review",
    "manual_signoff",
    "production_order_adapter_human_approval",
    "release_gate_human_approval"
  ],
  "controlledDevelopmentNotes": [
    "S0-S8 are the accepted historical implementation baseline and must not be presented as pending work.",
    "FTR-0 through FTR-6 must use docs/FTR_0_FTR_6_SUBSTAGE_ACCEPTANCE_MANIFESTS.json as the next-stage gate source.",
    "FTR-0 must run current-state consistency validation before any next-stage implementation.",
    "Deprecated benchmark aliases must not be persisted as new artifacts.",
    "S8 is limited to controlled intent-router and multi-turn safety enhancement, not unrestricted multi-step tool-calling.",
    "Each real user workbook requires fresh account-level revalidation before being used as evidence.",
    "Automated FTR completion may prepare a release review package but must not enable the production adapter or change any trading permission to true."
  ]
}
